{
  "$schema": "http://json-schema.org/draft-07/schema#",
  "$id": "https://nabcor.nabtiq.com/contracts/provider-reconciliation-record.schema.json",
  "title": "Provider reconciliation record",
  "description": "The immutable record reconciling NABCor's local smoke accounting against provider-visible usage (DEC-0020). It binds the smoke result and records the Product Owner's console observations (one request visible, model, usage, cost/delta, hard cap still active) and the reconciliation verdict. reconciled is true ONLY when exactly one request was observed, the returned model matched, usage agreed where the console exposes it, the local cost is within USD 0.01 of the provider-visible amount OR a per-request precision limitation is explicitly documented, the charge is no greater than USD 0.25, and the USD 60 hard cap remains active. Carries no credential or sensitive billing detail.",
  "type": "object",
  "required": [
    "schema_version",
    "artifact_id",
    "workspace",
    "brand_ref",
    "created_at",
    "smoke_result_ref",
    "smoke_result_digest",
    "requests_observed",
    "returned_model_matches",
    "local_input_tokens",
    "local_output_tokens",
    "local_settled_usd",
    "provider_input_tokens",
    "provider_output_tokens",
    "provider_usd",
    "usd_within_tolerance",
    "precision_limitation",
    "hard_cap_usd",
    "hard_cap_active",
    "reconciled",
    "product_owner_confirmation",
    "notes",
    "decision_ref"
  ],
  "properties": {
    "schema_version": { "type": "string", "pattern": "^\\d+\\.\\d+\\.\\d+$" },
    "artifact_id": { "type": "string", "pattern": "^[A-Za-z0-9][A-Za-z0-9._-]{0,127}$" },
    "workspace": { "type": "string", "pattern": "^[A-Za-z0-9][A-Za-z0-9._-]{0,127}$" },
    "brand_ref": { "type": "string", "pattern": "^[A-Za-z0-9][A-Za-z0-9._-]{0,127}$" },
    "created_at": { "type": "string", "format": "date-time" },
    "smoke_result_ref": { "type": "string", "pattern": "^[A-Za-z0-9][A-Za-z0-9._-]{0,127}$" },
    "smoke_result_digest": { "type": "string", "pattern": "^sha256:[0-9a-f]{64}$" },
    "requests_observed": {
      "type": "integer",
      "minimum": 0,
      "description": "number of matching requests the Product Owner observed in the provider console window; reconciliation requires exactly 1"
    },
    "returned_model_matches": { "type": "boolean" },
    "local_input_tokens": { "type": ["integer", "null"], "minimum": 0 },
    "local_output_tokens": { "type": ["integer", "null"], "minimum": 0 },
    "local_settled_usd": { "type": "number", "minimum": 0, "maximum": 0.25 },
    "provider_input_tokens": {
      "type": ["integer", "null"],
      "minimum": 0,
      "description": "provider-visible input tokens where the console exposes them; null when unavailable"
    },
    "provider_output_tokens": { "type": ["integer", "null"], "minimum": 0 },
    "provider_usd": {
      "type": ["number", "null"],
      "minimum": 0,
      "description": "provider-visible cost or usage delta where available; null when the console lacks per-request precision"
    },
    "usd_within_tolerance": {
      "type": "boolean",
      "description": "local settled cost is within USD 0.01 of provider_usd; may be true-by-limitation only when precision_limitation is true and provider_usd is null (semantic layer)"
    },
    "precision_limitation": {
      "type": "boolean",
      "description": "true when the console exposes insufficient per-request precision to compare cost exactly; the record documents this rather than claiming a false match"
    },
    "hard_cap_usd": { "const": 60 },
    "hard_cap_active": { "type": "boolean" },
    "reconciled": {
      "type": "boolean",
      "description": "the overall reconciliation verdict; the semantic layer enforces that true requires exactly one observed request, model match, within-tolerance (or documented limitation), charge <= 0.25, and the hard cap active"
    },
    "product_owner_confirmation": {
      "type": "string",
      "minLength": 1,
      "maxLength": 1000,
      "description": "the Product Owner's written console-observation confirmation; carries no credential or sensitive billing detail"
    },
    "notes": { "type": "string", "maxLength": 2000 },
    "decision_ref": { "type": "string", "pattern": "^DEC-\\d{4}$" }
  },
  "additionalProperties": false,
  "examples": [
    {
      "schema_version": "1.10.0",
      "artifact_id": "prr-example-0001",
      "workspace": "ws_governance",
      "brand_ref": "brand_nabcor",
      "created_at": "2026-07-20T00:30:00Z",
      "smoke_result_ref": "psr-example-0001",
      "smoke_result_digest": "sha256:ffffffffffffffffffffffffffffffffffffffffffffffffffffffffffffffff",
      "requests_observed": 1,
      "returned_model_matches": true,
      "local_input_tokens": 40,
      "local_output_tokens": 12,
      "local_settled_usd": 0.01,
      "provider_input_tokens": 40,
      "provider_output_tokens": 12,
      "provider_usd": 0.01,
      "usd_within_tolerance": true,
      "precision_limitation": false,
      "hard_cap_usd": 60,
      "hard_cap_active": true,
      "reconciled": true,
      "product_owner_confirmation": "Console shows exactly one Haiku request in the matching UTC window; usage 40 in / 12 out; monthly hard cap remains USD 60 and active.",
      "notes": "Synthetic smoke reconciliation; console per-request cost matched local calculation.",
      "decision_ref": "DEC-0020"
    }
  ]
}
