{
  "schema_version": "1.10.0",
  "artifact_id": "prr-anthropic-smoke-0001",
  "workspace": "ws_governance",
  "brand_ref": "brand_nabcor",
  "created_at": "2026-07-20T00:30:00Z",
  "smoke_result_ref": "psr-lpcr-anthropic-smoke-0001",
  "smoke_result_digest": "sha256:638a3b8ef392efb656479284eb0ea738c47fa9ce85df76e22112ef3179955731",
  "requests_observed": 1,
  "returned_model_matches": true,
  "local_input_tokens": 240,
  "local_output_tokens": 15,
  "local_settled_usd": 0.01,
  "provider_input_tokens": null,
  "provider_output_tokens": null,
  "provider_usd": null,
  "usd_within_tolerance": true,
  "precision_limitation": true,
  "hard_cap_usd": 60,
  "hard_cap_active": true,
  "reconciled": true,
  "product_owner_confirmation": "Console reviewed personally: exactly 1 API request visible for the NABCor workspace, model shown as Claude Haiku 4.5; per-request tokens and per-request cost not surfaced by the console; monthly hard spend cap USD 60 active; auto-reload disabled. No credential or sensitive billing detail included.",
  "notes": "Provider console did not expose per-request token counts, per-request cost, or the request id at this latency/granularity, so cost could not be compared to the cent; documented as a precision limitation rather than a silent match. Local settled_usd 0.01 is itself a cent-granular ceiling rounded up from the computed 0.000315 (240 in / 15 out at Haiku 1/5 per Mtok), so it is a conservative upper bound and <= USD 0.25. Request count (1) and model (Haiku 4.5) matched exactly; hard cap confirmed active.",
  "decision_ref": "DEC-0020"
}
